knn_score,cluster_score,gaussian_score,anomaly_score,composite_score,site_name,region,rank,similarity_reason
0.028752441573438238,0.05107557807577407,0.0,0.531617602046283,0.10257488937658936,Rua B,acre,8,Rua Bは①1km内地名数が多く平均・最短距離が小さいため高密度集落域、②距離偏差が小さく角度エントロピー･レンジが大きく周囲に放射状の副次集落を伴う中心拠点型配置、③河川から適度に離れつつ多様な川向きで氾濫を避けるテラス立地を示す。これらは既知アマゾン期遺跡の集落パターン・立地条件と一致するため類似性が高い。
0.011125516960589216,0.012655397683464539,0.0,0.5305071208088976,0.086633848478407,Ramal Porto Valter,acre,2,"地名間距離が平均より短い（min,mean,q75距離<0）密集立地で、河川に対して複数方向へ展開する配列（river_angle_std・angle_std高）がみられ、適度に河川から離れた段丘上に集落が連続するという配置は、アクレ州既知遺跡群の「水辺近接・高密度クラスター」型と一致する。さらに交通路名比率の高さは周辺集落間の往来を裏付け、先住農耕社会の儀礼・居住複合拠点としての特性を強く示す。"
0.00960951516336445,0.01960737928727029,0.0,0.5126712949717411,0.0851658693747563,Rua Rio Branco,acre,3,河川との平均距離・分散が高く、集落が本流から一定距離の支流帯に散在する点はacre州の土塁遺跡群と一致する。距離四分位や最小距離も同程度で、河川交通を利用しつつ洪水を回避した立地である。方位平均が大きく範囲が狭いのは川に並行する帯状配置を示し、防御・耕作地確保という既知遺跡の空間構成と合致する。水系比率がやや低く沖積台地に集中する点も共通し、総じて地形・集落パターンが類似する。
0.010546910835739571,0.016958294441099853,0.0,0.5141324427565974,0.08505085881627343,Rua Paraná,acre,4,地名間距離が短くばらつきも小さいため集落・施設が狭域に密集し、方位平均が際立つことから人工的に整列した区画を示唆する。河川から適度に離れた排水良好なテラフィルメ上で、現代道路比率も低く開発影響が少ない――これらはacre州の地上絵・溝状遺構が好む地形・立地条件と一致し、Rua Paraná が既知遺跡と類似する根拠となる。
0.006119440847218646,0.011360690454843416,0.0,0.5253314101518999,0.08378168843302236,Ramal das Graminhas,acre,5,河川に近く（min/mean river distanceが小さい）、地名間距離の分布（std・iqr・q75）が狭く密集度が高い。また角度指標（entropy・std）が高く、地名が360°に散らばる環状配置を示す。高速道路比率が低く現代改変が少ないため保存性も高い。これらはアクレ州の土塁集落遺跡と共通する「小河川沿いの自然堤上に環状に集住し、外部交通路から離れる」という立地・集落パターンと一致するため、遺跡の可能性が高い。
0.002887537354317328,0.0023475268460895126,0.0,0.5183204446512715,0.07934558648322416,Ramal 74,acre,6,min/mean_distance が平均より大きく負で地名が密集、angle_range が小さく方位が揃うため帯状・列状配置が推定される。river_angle_mean は既知遺跡と一致し、水資源に近接しつつ氾濫域を避けた典型的河岸段丘立地。std_distance が大きいことは周辺に衛星集落を伴う拠点集落型を示唆し、acre 地域で確認される複合サイトのパターンと合致するため類似性が高い。
0.0021418410413900925,0.00232187876368024,0.0,0.5200826048486589,0.07934250478270542,Ramal Cajarana,acre,7,河川からの距離が大きくかつ分散も高い点は、大河沿いではなく一段高い内陸台地に帯状集落が点在するアクレ州先史遺構の立地と一致する。距離四分位値の集中と方位分散の高さは、複数の円・方形土木施設が互いに視認できる範囲で群構する集落パターンを示唆し、水路比率の低さも台地立地を裏付けるため、既知遺跡と類似すると判断できる。
0.002256354189230167,0.0031907677195560473,0.0,0.48988762707189365,0.07507055995690362,Ramal Olho D'água,acre,1,距離統計が低分散・低最小値で周辺に地名が密集し、先住集落ネットワークの中核的パターンを示す。河川へは平均0.7σ内と適度に近く資源利用・交通に好適、対して道路比率が低く保存状態も既存遺跡並み。方位平均-1.4σはアクレ州地上絵群の環状‐直線配置と合致し、地形・集落構造・立地条件の三点で既知遺跡と極めて近似する。
